{
  "schema_version": "2.0",
  "document_id": "304:6310",
  "sentences": [
    {
      "id": "S1",
      "text": "If they continue to take the rights of transgender people, what's to stop them from taking the rights of others?"
    },
    {
      "id": "S2",
      "text": "Women?"
    },
    {
      "id": "S3",
      "text": "Religious minorities?"
    },
    {
      "id": "S4",
      "text": "Racial minorities?"
    },
    {
      "id": "S5",
      "text": "Where will it stop?"
    },
    {
      "id": "S6",
      "text": "We need to consider long term impacts."
    },
    {
      "id": "S7",
      "text": "Stop further targeting."
    },
    {
      "id": "S8",
      "text": "We need to stand up for all rights."
    }
  ],
  "propositions": [
    {
      "id": "P01",
      "text": "They continue to take the rights of transgender people",
      "source_sentence_ids": [
        "S1"
      ],
      "mode": "ASSERTED"
    },
    {
      "id": "P02",
      "text": "They take the rights of others",
      "source_sentence_ids": [
        "S1"
      ],
      "mode": "ASSERTED"
    },
    {
      "id": "P03",
      "text": "Is there anything that stops them from taking the rights of others?",
      "source_sentence_ids": [
        "S1"
      ],
      "mode": "QUESTION"
    },
    {
      "id": "P04",
      "text": "Are women at risk of having their rights taken?",
      "source_sentence_ids": [
        "S2"
      ],
      "mode": "QUESTION"
    },
    {
      "id": "P05",
      "text": "Are religious minorities at risk of having their rights taken?",
      "source_sentence_ids": [
        "S3"
      ],
      "mode": "QUESTION"
    },
    {
      "id": "P06",
      "text": "Are racial minorities at risk of having their rights taken?",
      "source_sentence_ids": [
        "S4"
      ],
      "mode": "QUESTION"
    },
    {
      "id": "P07",
      "text": "Where will the taking of rights stop?",
      "source_sentence_ids": [
        "S5"
      ],
      "mode": "QUESTION"
    },
    {
      "id": "P08",
      "text": "We need to consider long term impacts",
      "source_sentence_ids": [
        "S6"
      ],
      "mode": "ASSERTED"
    },
    {
      "id": "P09",
      "text": "Stop further targeting",
      "source_sentence_ids": [
        "S7"
      ],
      "mode": "NORMATIVE"
    },
    {
      "id": "P10",
      "text": "We need to stand up for all rights",
      "source_sentence_ids": [
        "S8"
      ],
      "mode": "NORMATIVE"
    }
  ],
  "references": [],
  "discourse_edges": [
    {
      "source_ids": [
        "P01"
      ],
      "target_id": "P02",
      "relation": "CONDITION",
      "connective": "if",
      "origin": "EXPLICIT",
      "evidence_sentence_ids": [
        "S1"
      ]
    }
  ],
  "argument_edges": []
}
