{
  "schema_version": "2.0",
  "document_id": "645:7932",
  "sentences": [
    {
      "id": "S1",
      "text": "So true! It is hard to believe that this censorship that Facebook is doing is still happening."
    },
    {
      "id": "S2",
      "text": "What happens next?"
    },
    {
      "id": "S3",
      "text": "Do they censor all political names so when anyone talks about any figure they get censored?"
    },
    {
      "id": "S4",
      "text": "This is going to lead to mass hysteria when no one can get any truthful information."
    },
    {
      "id": "S5",
      "text": "Chaos will reign!"
    },
    {
      "id": "S6",
      "text": "Everyone being blindsided by what is and isn't true, the government wants to confuse people to have total control over them."
    },
    {
      "id": "S7",
      "text": "Let's not let this happen!"
    },
    {
      "id": "S8",
      "text": "We have to fight this!"
    }
  ],
  "propositions": [
    {
      "id": "P01",
      "text": "Facebook is censoring content",
      "source_sentence_ids": [
        "S1"
      ],
      "mode": "ASSERTED"
    },
    {
      "id": "P02",
      "text": "It is hard to believe that Facebook is still censoring content",
      "source_sentence_ids": [
        "S1"
      ],
      "mode": "HEDGED"
    },
    {
      "id": "P03",
      "text": "What happens next?",
      "source_sentence_ids": [
        "S2"
      ],
      "mode": "QUESTION"
    },
    {
      "id": "P04",
      "text": "Facebook censors all political names",
      "source_sentence_ids": [
        "S3"
      ],
      "mode": "HYPOTHETICAL"
    },
    {
      "id": "P05",
      "text": "When anyone talks about any figure they get censored",
      "source_sentence_ids": [
        "S3"
      ],
      "mode": "HYPOTHETICAL"
    },
    {
      "id": "P06",
      "text": "This will lead to mass hysteria when no one can get any truthful information",
      "source_sentence_ids": [
        "S4"
      ],
      "mode": "CONDITIONAL"
    },
    {
      "id": "P07",
      "text": "Chaos will reign",
      "source_sentence_ids": [
        "S5"
      ],
      "mode": "ASSERTED"
    },
    {
      "id": "P08",
      "text": "Everyone is blindsided by what is and isn't true",
      "source_sentence_ids": [
        "S6"
      ],
      "mode": "ASSERTED"
    },
    {
      "id": "P09",
      "text": "The government wants to confuse people to have total control over them",
      "source_sentence_ids": [
        "S6"
      ],
      "mode": "ASSERTED"
    },
    {
      "id": "P10",
      "text": "We should not let this happen",
      "source_sentence_ids": [
        "S7"
      ],
      "mode": "NORMATIVE"
    },
    {
      "id": "P11",
      "text": "We have to fight this",
      "source_sentence_ids": [
        "S8"
      ],
      "mode": "WISH"
    }
  ],
  "references": [],
  "discourse_edges": [],
  "argument_edges": []
}
