{
  "schema_version": "2.0",
  "document_id": "1:2999",
  "sentences": [
    {
      "id": "S1",
      "text": "Some believe that the democratization of China is a good thing, but only think this way because it has become a popular opinion."
    },
    {
      "id": "S2",
      "text": "It's hardly a simple matter."
    },
    {
      "id": "S3",
      "text": "Perhaps the Chinese government knows what it best after all."
    },
    {
      "id": "S4",
      "text": "Many do think that the current Chinese government have their priorities straight."
    },
    {
      "id": "S5",
      "text": "We should let people decide for themselves."
    }
  ],
  "propositions": [
    {
      "id": "P01",
      "text": "Some believe that the democratization of China is a good thing",
      "source_sentence_ids": [
        "S1"
      ],
      "mode": "ASSERTED"
    },
    {
      "id": "P02",
      "text": "Some think this way only because it has become a popular opinion",
      "source_sentence_ids": [
        "S1"
      ],
      "mode": "ASSERTED"
    },
    {
      "id": "P03",
      "text": "It is hardly a simple matter",
      "source_sentence_ids": [
        "S2"
      ],
      "mode": "ASSERTED"
    },
    {
      "id": "P04",
      "text": "Perhaps the Chinese government knows what is best for it",
      "source_sentence_ids": [
        "S3"
      ],
      "mode": "HYPOTHETICAL"
    },
    {
      "id": "P05",
      "text": "Many think that the current Chinese government have their priorities straight",
      "source_sentence_ids": [
        "S4"
      ],
      "mode": "ASSERTED"
    },
    {
      "id": "P06",
      "text": "We should let people decide for themselves",
      "source_sentence_ids": [
        "S5"
      ],
      "mode": "NORMATIVE"
    }
  ],
  "references": [],
  "discourse_edges": [
    {
      "source_ids": [
        "P01"
      ],
      "target_id": "P02",
      "relation": "CONTRAST",
      "connective": "but",
      "origin": "EXPLICIT",
      "evidence_sentence_ids": [
        "S1"
      ]
    },
    {
      "source_ids": [
        "P02"
      ],
      "target_id": "P01",
      "relation": "CAUSAL",
      "connective": "because",
      "origin": "EXPLICIT",
      "evidence_sentence_ids": [
        "S1"
      ]
    }
  ],
  "argument_edges": []
}
