{
  "schema_version": "2.0",
  "document_id": "174:5320",
  "sentences": [
    {
      "id": "S1",
      "text": "Most people believe the radio station should be banned."
    },
    {
      "id": "S2",
      "text": "So the will of the people should be enforced."
    },
    {
      "id": "S3",
      "text": "The majority has a say, and the courts should not take that away."
    }
  ],
  "propositions": [
    {
      "id": "P01",
      "text": "Most people believe the radio station should be banned.",
      "source_sentence_ids": [
        "S1"
      ],
      "mode": "ASSERTED"
    },
    {
      "id": "P02",
      "text": "The will of the people should be enforced.",
      "source_sentence_ids": [
        "S2"
      ],
      "mode": "NORMATIVE"
    },
    {
      "id": "P03",
      "text": "The majority has a say.",
      "source_sentence_ids": [
        "S3"
      ],
      "mode": "ASSERTED"
    },
    {
      "id": "P04",
      "text": "The courts should not take that away.",
      "source_sentence_ids": [
        "S3"
      ],
      "mode": "NORMATIVE"
    }
  ],
  "references": [],
  "discourse_edges": [
    {
      "source_ids": [
        "P03"
      ],
      "target_id": "P04",
      "relation": "CONJUNCTION",
      "connective": "and",
      "origin": "EXPLICIT",
      "evidence_sentence_ids": [
        "S3"
      ]
    }
  ],
  "argument_edges": []
}
