{
  "schema_version": "2.0",
  "document_id": "296:10185",
  "sentences": [
    {
      "id": "S1",
      "text": "Waving off concerns as too simplistic may harm the efforts for overall freedom in the long term."
    },
    {
      "id": "S2",
      "text": "The battle no matter how small should be done and never disparaged."
    },
    {
      "id": "S3",
      "text": "Don't discount the small steps of progress, they can add up."
    }
  ],
  "propositions": [
    {
      "id": "P01",
      "text": "Waving off concerns as too simplistic",
      "source_sentence_ids": [
        "S1"
      ],
      "mode": "ASSERTED"
    },
    {
      "id": "P02",
      "text": "may harm the efforts for overall freedom in the long term",
      "source_sentence_ids": [
        "S1"
      ],
      "mode": "ASSERTED"
    },
    {
      "id": "P03",
      "text": "The battle no matter how small should be done",
      "source_sentence_ids": [
        "S2"
      ],
      "mode": "ASSERTED"
    },
    {
      "id": "P04",
      "text": "never disparaged",
      "source_sentence_ids": [
        "S2"
      ],
      "mode": "ASSERTED"
    },
    {
      "id": "P05",
      "text": "Don't discount the small steps of progress",
      "source_sentence_ids": [
        "S3"
      ],
      "mode": "ASSERTED"
    },
    {
      "id": "P06",
      "text": "they can add up",
      "source_sentence_ids": [
        "S3"
      ],
      "mode": "ASSERTED"
    }
  ],
  "references": [
    {
      "expression": "they",
      "sentence_id": "S3",
      "referent_proposition_ids": [
        "P05"
      ]
    }
  ],
  "discourse_edges": [
    {
      "source_ids": [
        "P03"
      ],
      "target_id": "P04",
      "relation": "CONJUNCTION",
      "connective": "and",
      "origin": "EXPLICIT",
      "evidence_sentence_ids": [
        "S2"
      ]
    }
  ],
  "argument_edges": []
}
