{
  "schema_version": "2.0",
  "document_id": "146:3885",
  "sentences": [
    {
      "id": "S1",
      "text": "The families of the victims in this travesty should continue to seek justice against those who committed those crimes."
    },
    {
      "id": "S2",
      "text": "The government allowed this violence to play to some extend it appears."
    },
    {
      "id": "S3",
      "text": "I feel more investigation is needed before this is pinned solely on the government."
    }
  ],
  "propositions": [
    {
      "id": "P01",
      "text": "The families of the victims in this travesty should continue to seek justice against those who committed those crimes.",
      "source_sentence_ids": [
        "S1"
      ],
      "mode": "ASSERTED"
    },
    {
      "id": "P02",
      "text": "The government allowed this violence to play.",
      "source_sentence_ids": [
        "S2"
      ],
      "mode": "ASSERTED"
    },
    {
      "id": "P03",
      "text": "It appears that the government allowed this violence to play.",
      "source_sentence_ids": [
        "S2"
      ],
      "mode": "HEDGED"
    },
    {
      "id": "P04",
      "text": "More investigation is needed.",
      "source_sentence_ids": [
        "S3"
      ],
      "mode": "ASSERTED"
    },
    {
      "id": "P05",
      "text": "This is pinned solely on the government.",
      "source_sentence_ids": [
        "S3"
      ],
      "mode": "HEDGED"
    }
  ],
  "references": [],
  "discourse_edges": [],
  "argument_edges": []
}
