{
  "schema_version": "2.0",
  "document_id": "645:9131",
  "sentences": [
    {
      "id": "S1",
      "text": "Whenever I hear about automated censorship on social media platforms, it's always targeting the wrong people."
    },
    {
      "id": "S2",
      "text": "It clearly is a system that doesn't work well, and probably never will."
    },
    {
      "id": "S3",
      "text": "Companies should just ditch the idea and get back to human moderation."
    }
  ],
  "propositions": [
    {
      "id": "P01",
      "text": "I hear about automated censorship on social media platforms",
      "source_sentence_ids": [
        "S1"
      ],
      "mode": "ASSERTED"
    },
    {
      "id": "P02",
      "text": "Automated censorship on social media platforms targets the wrong people",
      "source_sentence_ids": [
        "S1"
      ],
      "mode": "ASSERTED"
    },
    {
      "id": "P03",
      "text": "Automated censorship on social media platforms is a system that doesn't work well",
      "source_sentence_ids": [
        "S2"
      ],
      "mode": "ASSERTED"
    },
    {
      "id": "P04",
      "text": "Automated censorship on social media platforms probably never will work well",
      "source_sentence_ids": [
        "S2"
      ],
      "mode": "HEDGED"
    },
    {
      "id": "P05",
      "text": "Companies should ditch the idea of automated censorship",
      "source_sentence_ids": [
        "S3"
      ],
      "mode": "NORMATIVE"
    },
    {
      "id": "P06",
      "text": "Companies should get back to human moderation",
      "source_sentence_ids": [
        "S3"
      ],
      "mode": "NORMATIVE"
    }
  ],
  "references": [],
  "discourse_edges": [
    {
      "source_ids": [
        "P03"
      ],
      "target_id": "P04",
      "relation": "CONJUNCTION",
      "connective": "and",
      "origin": "EXPLICIT",
      "evidence_sentence_ids": [
        "S2"
      ]
    },
    {
      "source_ids": [
        "P05"
      ],
      "target_id": "P06",
      "relation": "CONJUNCTION",
      "connective": "and",
      "origin": "EXPLICIT",
      "evidence_sentence_ids": [
        "S3"
      ]
    }
  ],
  "argument_edges": []
}
