{
  "schema_version": "2.0",
  "document_id": "239:4913",
  "sentences": [
    {
      "id": "S1",
      "text": "Once you get youth active in doing something they may never cease."
    },
    {
      "id": "S2",
      "text": "They may do things they should take no part in."
    },
    {
      "id": "S3",
      "text": "Society's road to anarchy is possibly paved."
    }
  ],
  "propositions": [
    {
      "id": "P01",
      "text": "you get youth active in doing something",
      "source_sentence_ids": [
        "S1"
      ],
      "mode": "ASSERTED"
    },
    {
      "id": "P02",
      "text": "they may never cease",
      "source_sentence_ids": [
        "S1"
      ],
      "mode": "HYPOTHETICAL"
    },
    {
      "id": "P03",
      "text": "They may do things",
      "source_sentence_ids": [
        "S2"
      ],
      "mode": "HYPOTHETICAL"
    },
    {
      "id": "P04",
      "text": "they should take no part in",
      "source_sentence_ids": [
        "S2"
      ],
      "mode": "NORMATIVE"
    },
    {
      "id": "P05",
      "text": "Society's road to anarchy is possibly paved",
      "source_sentence_ids": [
        "S3"
      ],
      "mode": "HYPOTHETICAL"
    }
  ],
  "references": [
    {
      "expression": "they",
      "sentence_id": "S1",
      "referent_proposition_ids": [
        "P01"
      ]
    },
    {
      "expression": "They",
      "sentence_id": "S2",
      "referent_proposition_ids": [
        "P01"
      ]
    },
    {
      "expression": "they",
      "sentence_id": "S2",
      "referent_proposition_ids": [
        "P01"
      ]
    }
  ],
  "discourse_edges": [],
  "argument_edges": []
}
