{
  "schema_version": "2.0",
  "document_id": "565:8893",
  "sentences": [
    {
      "id": "S1",
      "text": "It's fascinating to read that Myanmar is trending towards a media climate that is more free and open."
    },
    {
      "id": "S2",
      "text": "That gives me optimism that all repressive countries are on the fast track to giving the media vast amounts of freedom."
    },
    {
      "id": "S3",
      "text": "Yes is only one country, but it does show that this is possible and on the rise."
    },
    {
      "id": "S4",
      "text": "Who would not find that exciting and a push towards a greater future?"
    },
    {
      "id": "S5",
      "text": "I can see this becoming a popular trend and all of us becoming accustomed to freedom reigning supreme."
    },
    {
      "id": "S6",
      "text": "What an amazing time that will be!"
    }
  ],
  "propositions": [
    {
      "id": "P01",
      "text": "Myanmar is trending towards a media climate that is more free and open",
      "source_sentence_ids": [
        "S1"
      ],
      "mode": "ASSERTED"
    },
    {
      "id": "P02",
      "text": "I am optimistic that all repressive countries are on the fast track to giving the media vast amounts of freedom",
      "source_sentence_ids": [
        "S2"
      ],
      "mode": "ASSERTED"
    },
    {
      "id": "P03",
      "text": "Myanmar is the only country mentioned",
      "source_sentence_ids": [
        "S3"
      ],
      "mode": "ASSERTED"
    },
    {
      "id": "P04",
      "text": "Myanmar being the only country shows that this is possible and on the rise",
      "source_sentence_ids": [
        "S3"
      ],
      "mode": "ASSERTED"
    },
    {
      "id": "P05",
      "text": "The situation is exciting and a push towards a greater future",
      "source_sentence_ids": [
        "S4"
      ],
      "mode": "HEDGED"
    },
    {
      "id": "P06",
      "text": "I can see this becoming a popular trend",
      "source_sentence_ids": [
        "S5"
      ],
      "mode": "ASSERTED"
    },
    {
      "id": "P07",
      "text": "All of us will become accustomed to freedom reigning supreme",
      "source_sentence_ids": [
        "S5"
      ],
      "mode": "ASSERTED"
    },
    {
      "id": "P08",
      "text": "It will be an amazing time",
      "source_sentence_ids": [
        "S6"
      ],
      "mode": "EVALUATION"
    }
  ],
  "references": [],
  "discourse_edges": [],
  "argument_edges": []
}
